### ISSUE TITLE
request through `kubectl port forward` doesn't get stolen

### ISSUE THREAD

**Issue by aviramha** [metalbear-co/mirrord#1479]
When stealing pod requests, if one uses `kubectl port forward deploy/deploymentname 8080` those requests still get answered by the remote.

**Comment by infiniteregrets** [comment]
with steal on and sending request to the nodeport:
```
15:38:32.077374 IP 192-168-65-4.kubernetes.default.svc.cluster.local.60460 > py-serv-deployment-ff89b5974-dhl2q.http: Flags [S], seq 439708412, win 64240, options [mss 1460,sackOK,TS val 3218045251 ecr 0,nop,wscale 7], length 0
15:38:32.077437 IP py-serv-deployment-ff89b5974-dhl2q.http > 192-168-65-4.kubernetes.default.svc.cluster.local.60460: Flags [S.], seq 2983302851, ack 439708413, win 65160, options [mss 1460,sackOK,TS val 3669149584 ecr 3218045251,nop,wscale 7], length 0
15:38:32.077507 IP 192-168-65-4.kubernetes.default.svc.cluster.local.60460 > py-serv-deployment-ff89b5974-dhl2q.http: Flags [.], ack 1, win 502, options [nop,nop,TS val 3218045251 ecr 3669149584], length 0
15:38:32.078247 IP 192-168-65-4.kubernetes.default.svc.cluster.local.60460 > py-serv-deployment-ff89b5974-dhl2q.http: Flags [P.], seq 1:80, ack 1, win 502, options [nop,nop,TS val 3218045251 ecr 3669149584], length 79: HTTP: GET / HTTP/1.1
15:38:32.078281 IP py-serv-deployment-ff89b5974-dhl2q.http > 192-168-65-4.kubernetes.default.svc.cluster.local.60460: Flags [.], ack 80, win 509, options [nop,nop,TS val 3669149584 ecr 3218045251], length 0
15:38:32.084998 IP py-serv-deployment-ff89b5974-dhl2q.http > 192-168-65-4.kubernetes.default.svc.cluster.local.60460: Flags [P.], seq 1:175, ack 80, win 509, options [nop,nop,TS val 3669149591 ecr 3218045251], length 174: HTTP: HTTP/1.1 200 OK
15:38:32.085091 IP 192-168-65-4.kubernetes.default.svc.cluster.local.60460 > py-serv-deployment-ff89b5974-dhl2q.http: Flags [.], ack 175, win 501, options [nop,nop,TS val 3218045258 ecr 3669149591], length 0
15:38:32.085144 IP py-serv-deployment-ff89b5974-dhl2q.http > 192-168-65-4.kubernetes.default.svc.cluster.local.60460: Flags [F.], seq 175, ack 80, win 509, options [nop,nop,TS val 3669149591 ecr 3218045258], length 0
15:38:32.087129 IP 192-168-65-4.kubernetes.default.svc.cluster.local.60460 > py-serv-deployment-ff89b5974-dhl2q.http: Flags [F.], seq 80, ack 176, win 501, options [nop,nop,TS val 3218045260 ecr 3669149591], length 0
15:38:32.087182 IP py-serv-deployment-ff89b5974-dhl2q.http > 192-168-65-4.kubernetes.default.svc.cluster.local.60460: Flags [.], ack 81, win 509, options [nop,nop,TS val 3669149593 ecr 3218045260], length 0
15:38:37.194501 ARP, Request who-has 10.1.0.1 tell py-serv-deployment-ff89b5974-dhl2q, length 28
15:38:37.194600 ARP, Request who-has py-serv-deployment-ff89b5974-dhl2q tell 10.1.0.1, length 28
15:38:37.194610 ARP, Reply py-serv-deployment-ff89b5974-dhl2q is-at 2a:35:01:cf:2e:a2 (oui Unknown), length 28
15:38:37.194613 ARP, Reply 10.1.0.1 is-at d2:1a:da:1e:7f:70 (oui Unknown), length 28
```

clearly, there is a TCP exchange, however when sending a request with kubectl port-forward, there is no such exchange, I believe it is because of how kubectl port-forward works?


https://kubernetes.io/docs/reference/generated/kubectl/kubectl-commands#port-forward

```
Creates a proxy server or application-level gateway between localhost and the Kubernetes API server. It also allows serving static content over specified HTTP path. All incoming data enters through one port and gets forwarded to the remote Kubernetes API server port, except for the path matching the static content path.
```
wondering what is the use case here?
